### ISSUE TITLE
The VNC protocol cannot be handled correctly with passt network 

### ISSUE THREAD

**Issue by caijian76** [kubevirt/kubevirt#11591]
k8s 1.27
kubevirt 1.20
centos 8
Create a vm , and config VNC server (port:5901) in vm. and expose the port to k8s nodeport 
When config vm with masquerade network mode , VNC Client  can connect correctly .
When config vm with passt network mode ,VNC client cannot be handled correctly .(I tried some other protocols, etc ,ssh http, and they worked fine ).

**Comment by sbrivio-rh** [comment]
@caijian76, thanks for reporting this. Could you please give a few more details about how the client fails? What fails exactly, is the TCP connection refused or is this at RFB level? A client-side packet capture would be ideal.

**Comment by caijian76** [comment]
1. VM using  passt network , expose 5901 to  nodeport 60892 ,when I connect using VNC Client and tcpdump zhe node's 60892 port . VNC client was hold and then timeout connect .
```
14:08:31.111146 IP 192.168.0.76.59518 > 172.16.100.14.60892: Flags [S], seq 1094245283, win 65535, options [mss 1280,nop,wscale 6,nop,nop,TS val 2701223018 ecr 0,sackOK,eol], length 0
14:08:31.111313 IP 172.16.100.14.60892 > 192.168.0.76.59518: Flags [S.], seq 3669295294, ack 1094245284, win 65535, options [mss 1440,sackOK,TS val 2308915383 ecr 2701223018,nop,wscale 10], length 0
14:08:31.116767 IP 192.168.0.76.59518 > 172.16.100.14.60892: Flags [.], ack 1, win 2052, options [nop,nop,TS val 2701223029 ecr 2308915383], length 0
```

**Comment by sbrivio-rh** [comment]
So, from the working case:

```
14:25:09.521408 IP 192.168.0.76.59631 > 172.16.100.14.60892: Flags [S], seq 2554925821, win 65535, options [mss 1280,nop,wscale 6,nop,nop,TS val 300055167 ecr 0,sackOK,eol], length 0
14:25:09.522110 IP 172.16.100.14.60892 > 192.168.0.76.59631: Flags [S.], seq 3528770665, ack 2554925822, win 64260, options [mss 1440,sackOK,TS val 3062498049 ecr 300055167,nop,wscale 7], length 0
14:25:09.525988 IP 192.168.0.76.59631 > 172.16.100.14.60892: Flags [.], ack 1, win 2052, options [nop,nop,TS val 300055171 ecr 3062498049], length 0
14:25:09.526909 IP 172.16.100.14.60892 > 192.168.0.76.59631: Flags [P.], seq 1:13, ack 1, win 503, options [nop,nop,TS val 3062498054 ecr 300055171], length 12
```

I see that the server sends its version (presumably `RFB 003.00x\n`, 12 bytes) right after the three-way handshake. With passt, the client completes the TCP handshake, but doesn't get the RFB identification.

RFB is somewhat particular in that the first message once the connection is established is sent by the server, not by the client, which waits for the server, similarly to SMTP (client waits for server's banner).

A while ago, we [fixed](https://passt.top/passt/commit/?id=9178a9e3462d7fb931e4316d99eccbb3e7460cb7) an issue with SMTP in passt, which brings me to the question: which version of passt is used there?

The first version including this fix was `2023_09_08.05627dc`, first included in CentOS Stream 9 version `0^20231204.gb86afe3`.

**Comment by caijian76** [comment]
I not know how find the passt version ,I just install kubevirt Passt CNI plugin from https://github.com/kubevirt/kubevirt/releases/download/v1.1.1/kubevirt-passt-binding , and Sidecar image quay.io/kubevirt/network-passt-binding:20231205_29a16d5c9

**Comment by sbrivio-rh** [comment]
Oh, I see, so that problem is actually expected, sorry.

I noticed that https://github.com/kubevirt/kubevirt/pull/11256 is pending, and that will update passt to `0^20231204.gb86afe3-1.el9`, but I don't know how long it will take before it's merged.

I'm not sure if there's a way to override the version of passt -- probably `rpm-ostree` on the node would do the trick? [passt-0^20230222.g4ddbcb9-4.el9.x86_64.rpm](https://mirror.stream.centos.org/9-stream/AppStream/x86_64/os/Packages/passt-0%5e20230222.g4ddbcb9-4.el9.x86_64.rpm) is already available for CentOS Stream.

**Comment by caijian76** [comment]
@sbrivio-rh  Thank you very much ,I think we've found the cause of the problem.waiting for repair.

**Comment by caijian76** [comment]
Are you sure new rpm version is 20230222 ?    not 2024  ? @sbrivio-rh

**Comment by sbrivio-rh** [comment]
> Are you sure new rpm version is 20230222 ? not 2024 ? @sbrivio-rh

No, that was a mistake, see also https://github.com/kubevirt/kubevirt/pull/11256#issuecomment-2022397078.

The most recent version available for CentOS Stream is `0^20231204.gb86afe3-1.el9`. That's anyway recent enough to fix this issue.

**Comment by caijian76** [comment]
OK，I build new quay.io/kubevirt/virt-launcher:v1.2.0 , replace passt and passt.avx2 file use 0^20231204.gb86afe3-1.el9 ，it's work fine.

**Comment by caijian76** [comment]
@sbrivio-rh #11896

**Comment by sbrivio-rh** [comment]
Now that passt has been upgraded to version `0^20240624.g1ee2eca-1.el9` by https://github.com/kubevirt/kubevirt/pull/12452, this is solved and can be closed.

**Comment by xpivarc** [comment]
/close
Please reopen if you see any problem
