### ISSUE TITLE
Connection reset from VM to a service running on the same node

### ISSUE THREAD

**Issue by zakkg3** [kubevirt/kubevirt#4340]
Vms running on the same node as a nginx service, with the same multus bridge interface and vlan: does not work.
Pod on the same node with the same multus interface works.
Vms on another nodes but same vlan (multus bridge interface) works.

Iam running a local mirror: Nginx exposed with a service (external ip).This external ip is routed to the k8s cluster.

Vms have a multus cni interface on certain network.

I thought it could be a [DNAT / conntrack issue](https://kubernetes.io/blog/2019/03/29/kube-proxy-subtleties-debugging-an-intermittent-connection-reset/
). but It should be fixed in k8s 1.18 and it works pod-service, its just vm-service the problem. so iam a little bit confused.

I open this question here to see if someone have an idea on what it could be the problem or if someone experienced something similar...

Vm failing:
```
[root@test-login-02 ~]# curl -I  http://10.206.151.15/epel/7/x86_64/Packages/v/v8-python-3.14.5.10-25.el7.x86_64.rpm
curl: (56) Recv failure: Connection reset by peer
[root@test-login-02 ~]# ping 10.206.151.15
PING 10.206.151.15 (10.206.151.15) 56(84) bytes of data.
64 bytes from 10.206.151.15: icmp_seq=1 ttl=63 time=0.276 ms
64 bytes from 10.206.151.15: icmp_seq=2 ttl=63 time=0.363 ms
```

Pod running on the same node with the same multus cni network attach definition works:
```
root@debugtool:/# curl -I  http://10.206.151.15/epel/7/x86_64/Packages/v/v8-python-3.14.5.10-25.el7.x86_64.rpm
HTTP/1.1 200 OK
Server: nginx/1.18.0
Date: Thu, 08 Oct 2020 13:40:57 GMT
Content-Type: application/x-redhat-package-manager
Content-Length: 30312
Last-Modified: Wed, 27 Jul 2016 15:49:38 GMT
Connection: keep-alive
ETag: "5798d812-7668"
Accept-Ranges: bytes
```

Vms in another nodes, with the same net-attach-def works too:

```
[root@test-dev-01 ~]# curl -I  http://10.206.151.15/epel/7/x86_64/Packages/v/v8-python-3.14.5.10-25.el7.x86_64.rpm
HTTP/1.1 200 OK
Server: nginx/1.18.0
Date: Thu, 08 Oct 2020 13:43:06 GMT
Content-Type: application/x-redhat-package-manager
Content-Length: 30312
Last-Modified: Wed, 27 Jul 2016 15:49:38 GMT
Connection: keep-alive
ETag: "5798d812-7668"
Accept-Ranges: bytes
```

On tcpdump we can only see the VM sending a 'reset' package after the mirror is sending a weird  ack (3842026422) ?:

```
09:44:06.526146 IP vm-hostname.41752  network.address.http: Flags [P.], seq 1:157, ack 1, win 210, options [nop,nop,TS val 290443317 ecr 1284826686], length 156: HTTP: GET /mlnx-ofed/5.0-2.1.8.0-rhel7.8-x86_64/RPMS/MLNX_LIBS/repodata/repomd.xml HTTP/1.1
09:44:06.526256 IP network.address.325 > vm-hostname.41752: Flags [.], ack 3842026422, win 489, options [nop,nop,TS val 1284826687 ecr 290443317], length 0
09:44:06.526372 IP vm-hostname.41752 > network.address.325: Flags [R], seq 3842026422, win 0, length 0
```

This is how it would typically happen on a working VM:

```
09:56:01.219410 IP working-vm-hostname.56222 > network.address.http: Flags [P.], seq 1:157, ack 1, win 210, options [nop,nop,TS val 580178630 ecr 3579550366], length 156: HTTP: GET /mlnx-ofed/5.0-2.1.8.0-rhel7.8-x86_64/RPMS/MLNX_LIBS/repodata/repomd.xml HTTP/1.1
09:56:01.219480 IP network.address.http > working-vm-hostname.56222: Flags [.], ack 157, win 489, options [nop,nop,TS val 3579550366 ecr 580178630], length 0
09:56:01.221434 IP network.address.http > working-vm-hostname.56222: Flags [P.], seq 1:
```

but wait, when do a tcpdump **-i any**

```
root@kuberenetes-wierd-node:~# tcpdump host 10.206.151.15 -i any
16:11:20.508029 IP 10.212.57.14.48142 > network-address.http: Flags [S], seq 2053912339, win 26880, options [mss 8960,sackOK,TS val 194075327 ecr 0,nop,wscale 7], length 0
16:11:20.508057 IP 10.212.57.14.48142 > network-address.http: Flags [S], seq 2053912339, win 26880, options [mss 8960,sackOK,TS val 194075327 ecr 0,nop,wscale 7], length 0
16:11:20.508060 ethertype IPv4, IP 10.212.57.14.48142 > network-address.http: Flags [S], seq 2053912339, win 26880, options [mss 8960,sackOK,TS val 194075327 ecr 0,nop,wscale 7], length 0
16:11:20.508062 ethertype IPv4, IP 10.212.57.14.48142 > network-address.http: Flags [S], seq 2053912339, win 26880, options [mss 8960,sackOK,TS val 194075327 ecr 0,nop,wscale 7], length 0
16:11:20.508083 IP 10.212.57.14.48142 > network-address.http: Flags [S], seq 2053912339, win 26880, options [mss 8960,sackOK,TS val 194075327 ecr 0,nop,wscale 7], length 0
16:11:20.508083 IP 10.212.57.14.48142 > network-address.http: Flags [S], seq 2053912339, win 26880, options [mss 8960,sackOK,TS val 194075327 ecr 0,nop,wscale 7], length 0
16:11:20.508919 IP network-address.http > 10.212.57.14.48142: Flags [S.], seq 4104588868, ack 2053912340, win 62636, options [mss 8960,sackOK,TS val 1118790006 ecr 194075327,nop,wscale 7], length 0
16:11:20.710601 IP 10.212.57.14.48142 > network-address.http: Flags [P.], seq 1:141, ack 1, win 210, options [nop,nop,TS val 194075530 ecr 1118790006], length 140: HTTP: HEAD /epel/7/x86_64/Packages/v/v8-python-3.14.5.10-25.el7.x86_64.rpm HTTP/1.1
16:11:20.710620 IP 10.212.57.14.48142 > network-address.http: Flags [P.], seq 1:141, ack 1, win 210, options [nop,nop,TS val 194075530 ecr 1118790006], length 140: HTTP: HEAD /epel/7/x86_64/Packages/v/v8-python-3.14.5.10-25.el7.x86_64.rpm HTTP/1.1
16:11:20.710623 ethertype IPv4, IP 10.212.57.14.48142 > network-address.http: Flags [P.], seq 1:141, ack 1, win 210, options [nop,nop,TS val 194075530 ecr 1118790006], length 140: HTTP: HEAD /epel/7/x86_64/Packages/v/v8-python-3.14.5.10-25.el7.x86_64.rpm HTTP/1.1
16:11:20.710627 ethertype IPv4, IP 10.212.57.14.48142 > network-address.http: Flags [P.], seq 1:141, ack 1, win 210, options [nop,nop,TS val 194075530 ecr 1118790006], length 140: HTTP: HEAD /epel/7/x86_64/Packages/v/v8-python-3.14.5.10-25.el7.x86_64.rpm HTTP/1.1
16:11:20.710764 IP 10.212.57.14.48142 > network-address.http: Flags [P.], seq 1:141, ack 1, win 210, options [nop,nop,TS val 194075530 ecr 1118790006], length 140: HTTP: HEAD /epel/7/x86_64/Packages/v/v8-python-3.14.5.10-25.el7.x86_64.rpm HTTP/1.1
16:11:20.710764 IP 10.212.57.14.48142 > network-address.http: Flags [P.], seq 1:141, ack 1, win 210, options [nop,nop,TS val 194075530 ecr 1118790006], length 140: HTTP: HEAD /epel/7/x86_64/Packages/v/v8-python-3.14.5.10-25.el7.x86_64.rpm HTTP/1.1
16:11:20.710842 IP network-address.http > 10.212.57.14.48142: Flags [R], seq 4104588869, win 0, length 0
16:11:20.710847 IP network-address.http > 10.212.57.14.48142: Flags [R], seq 4104588869, win 0, length 0
16:11:20.710886 ethertype IPv4, IP network-address.http > 10.212.57.14.48142: Flags [R], seq 4104588869, win 0, length 0
16:11:20.710886 ethertype IPv4, IP network-address.http > 10.212.57.14.48142: Flags [R], seq 4104588869, win 0, length 0
16:11:20.710886 IP network-address.http > 10.212.57.14.48142: Flags [R], seq 4104588869, win 0, length 0
16:11:20.710905 IP network-address.http > 10.212.57.14.48142: Flags [R], seq 4104588869, win 0, length 0
```

**Environment**:
- KubeVirt version (use `virtctl version`):
```
virtctl version
Client Version: version.Info{GitVersion:"v0.23.3", GitCommit:"f583b0e3a6317e3c5adfda90484983d74ddb58cd", GitTreeState:"clean", BuildDate:"2020-01-16T14:10:50Z", GoVersion:"go1.12.8", Compiler:"gc", Platform:"darwin/amd64"}
Server Version: version.Info{GitVersion:"{gitVersion}", GitCommit:"{gitCommit}", GitTreeState:"{gitTreeState}", BuildDate:"{buildDate}", GoVersion:"go1.12.8", Compiler:"gc", Platform:"linux/amd64"}
```
- Kubernetes version (use `kubectl version`):
```
kubectl version
Client Version: version.Info{Major:"1", Minor:"18", GitVersion:"v1.18.3", GitCommit:"2e7996e3e2712684bc73f0dec0200d64eec7fe40", GitTreeState:"clean", BuildDate:"2020-05-21T14:51:23Z", GoVersion:"go1.14.3", Compiler:"gc", Platform:"darwin/amd64"}
Server Version: version.Info{Major:"1", Minor:"17", GitVersion:"v1.17.4", GitCommit:"8d8aa39598534325ad77120c120a22b3a990b5ea", GitTreeState:"clean", BuildDate:"2020-03-12T20:55:23Z", GoVersion:"go1.13.8", Compiler:"gc", Platform:"linux/amd64"}
```

- VM or VMI specifications:
it have a multus interfacte:
```
          interfaces:
          - name: access
            bridge: {}
      networks:
      - name: access
        multus:
          default: true
          networkName: a-namespace/access
```

- Cloud provider or hardware configuration:
bare metal.
- OS (e.g. from /etc/os-release):
 `5.3.0-59-generic #53~18.04.1-Ubuntu SMP Thu Jun 4 14:58:26 UTC 2020 x86_64 x86_64 x86_64 GNU/Linux`

**Comment by zakkg3** [comment]
My pod had 2 interfaces. The native k8s and the multus cni. the service i was reaching via the native iface.

Now iam running a pod with only 1 interface, with :

```
  annotations:
    v1.multus-cni.io/default-network: namespace-name/net-attach-deff-name
```

and now it does not work:

```
root@debugtool:/# curl -I 10.206.151.15
curl: (56) Recv failure: Connection reset by peer
```

So its not a Kubevirt problem. its a multus CNI  problem.

closing this here 
Sorry for the noise.
