### ISSUE TITLE
network doesn't work fine when vm with masquerade interface  

### ISSUE THREAD

**Issue by todaygood** [kubevirt/kubevirt#4597]
> /kind bug

**What happened**:
failed to curl vm's nginx homepage when vm with masquerade interface.

```
[root@CNSZ335291 vm-migratable]# kubectl get pod -o wide |grep -i centos850
virt-launcher-centos850-gl2dj             1/1     Running   0          117m   172.16.250.13   cnsz335293   <none>           <none>
[root@CNSZ335291 vm-migratable]# ping -c 3 172.16.250.13
PING 172.16.250.13 (172.16.250.13) 56(84) bytes of data.
64 bytes from 172.16.250.13: icmp_seq=1 ttl=63 time=0.179 ms
64 bytes from 172.16.250.13: icmp_seq=2 ttl=63 time=0.145 ms
64 bytes from 172.16.250.13: icmp_seq=3 ttl=63 time=0.117 ms

--- 172.16.250.13 ping statistics ---
3 packets transmitted, 3 received, 0% packet loss, time 1999ms
rtt min/avg/max/mdev = 0.117/0.147/0.179/0.025 ms
[root@CNSZ335291 vm-migratable]# telnet 172.16.250.13 80
Trying 172.16.250.13...
telnet: connect to address 172.16.250.13: Connection timed out



[root@CNSZ335291 vm-migratable]# kubectl get vmi
NAME        AGE    PHASE     IP                NODENAME
centos724   18h    Running   172.16.250.9/32   cnsz335293
centos850   118m   Running   172.16.250.13     cnsz335293
[root@CNSZ335291 vm-migratable]# kubectl describe vmi centos850
Name:         centos850
Namespace:    default
Labels:       kubevirt.io/nodeName=cnsz335293
Annotations:  kubevirt.io/latest-observed-api-version: v1alpha3
              kubevirt.io/storage-observed-api-version: v1alpha3
API Version:  kubevirt.io/v1alpha3
Kind:         VirtualMachineInstance
Metadata:
  Creation Timestamp:  2020-11-27T01:47:08Z
  Finalizers:
    foregroundDeleteVirtualMachine
  Generation:  59
  Managed Fields:
    API Version:  kubevirt.io/v1alpha3
    Fields Type:  FieldsV1
    fieldsV1:
      f:metadata:
        f:annotations:
          .:
          f:kubevirt.io/latest-observed-api-version:
          f:kubevirt.io/storage-observed-api-version:
        f:labels:
          .:
          f:kubevirt.io/nodeName:
        f:ownerReferences:
      f:spec:
        .:
        f:domain:
          .:
          f:cpu:
            .:
            f:cores:
          f:devices:
            .:
            f:disks:
            f:interfaces:
          f:firmware:
            .:
            f:uuid:
          f:machine:
            .:
            f:type:
          f:resources:
            .:
            f:requests:
              .:
              f:memory:
        f:networks:
        f:terminationGracePeriodSeconds:
        f:volumes:
      f:status:
        .:
        f:activePods:
          .:
          f:e919e008-e200-456e-8ba0-1bd8439dcc26:
        f:guestOSInfo:
        f:nodeName:
        f:qosClass:
    Manager:      virt-controller
    Operation:    Update
    Time:         2020-11-27T01:47:14Z
    API Version:  kubevirt.io/v1alpha3
    Fields Type:  FieldsV1
    fieldsV1:
      f:status:
        f:conditions:
        f:guestOSInfo:
          f:id:
          f:kernelRelease:
          f:kernelVersion:
          f:name:
          f:prettyName:
          f:version:
          f:versionId:
        f:interfaces:
        f:migrationMethod:
        f:phase:
    Manager:    virt-handler
    Operation:  Update
    Time:       2020-11-27T03:45:25Z
  Owner References:
    API Version:           kubevirt.io/v1alpha3
    Block Owner Deletion:  true
    Controller:            true
    Kind:                  VirtualMachine
    Name:                  centos850
    UID:                   b6134d2d-689b-4d18-ab99-55f912d3dee0
  Resource Version:        344024
  Self Link:               /apis/kubevirt.io/v1alpha3/namespaces/default/virtualmachineinstances/centos850
  UID:                     1d99fec6-1967-4648-a682-6737eadda1f9
Spec:
  Domain:
    Cpu:
      Cores:  2
    Devices:
      Disks:
        Disk:
          Bus:  virtio
        Name:   disk0
        Cdrom:
          Bus:       sata
          Readonly:  true
          Tray:      closed
        Name:        cloudinitdisk
      Interfaces:
        Masquerade:
        Name:  default
        Ports:
          Name:      http
          Port:      80
          Protocol:  TCP
    Features:
      Acpi:
        Enabled:  true
    Firmware:
      Uuid:  870a9583-9180-5f8b-8e61-4c3bbd1ea782
    Machine:
      Type:  q35
    Resources:
      Requests:
        Cpu:     100m
        Memory:  2048M
  Networks:
    Name:  default
    Pod:
  Termination Grace Period Seconds:  0
  Volumes:
    Name:  disk0
    Persistent Volume Claim:
      Claim Name:  centos850-qcow2
    Cloud Init No Cloud:
      User Data:  #cloud-config
hostname: centos850
ssh_pwauth: True
disable_root: False
    Name:  cloudinitdisk
Status:
  Active Pods:
    e919e008-e200-456e-8ba0-1bd8439dcc26:  cnsz335293
  Conditions:
    Last Probe Time:       <nil>
    Last Transition Time:  <nil>
    Status:                True
    Type:                  LiveMigratable
    Last Probe Time:       <nil>
    Last Transition Time:  2020-11-27T01:47:05Z
    Status:                True
    Type:                  Ready
    Last Probe Time:       2020-11-27T03:45:19Z
    Last Transition Time:  <nil>
    Status:                True
    Type:                  AgentConnected
  Guest OS Info:
    Id:              centos
    Kernel Release:  3.10.0-1127.el7.x86_64
    Kernel Version:  #1 SMP Tue Mar 31 23:36:51 UTC 2020
    Name:            CentOS Linux
    Pretty Name:     CentOS Linux 7 (Core)
    Version:         7
    Version Id:      7
  Interfaces:
    Interface Name:  eth0
    Ip Address:      172.16.250.13
    Ip Addresses:
      172.16.250.13
    Mac:             02:00:00:a2:bb:18
    Name:            default
  Migration Method:  BlockMigration
  Node Name:         cnsz335293
  Phase:             Running
  Qos Class:         Burstable
Events:
  Type    Reason   Age                     From          Message
  ----    ------   ----                    ----          -------
  Normal  Created  2m21s (x139 over 118m)  virt-handler  VirtualMachineInstance defined.

```

**What you expected to happen**:
I can visit vm's nginx homepage  in k8s node 

**How to reproduce it (as minimally and precisely as possible)**:
always

**Anything else we need to know?**:

# in vm centos850 
when I telent podip:80  ， I didn't capture any packet in vm.  In the vm , I enabled nginx service.
```
[root@centos850 ~]# ip r
default via 10.0.2.1 dev eth0
10.0.2.0/24 dev eth0 proto kernel scope link src 10.0.2.2
[root@centos850 ~]# tcpdump -i eth0 -enn
[ 6687.820805] device eth0 entered promiscuous mode
tcpdump: verbose output suppressed, use -v or -vv for full protocol decode
listening on eth0, link-type EN10MB (Ethernet), capture size 262144 bytes

0 packets captured
0 packets re[ 7209.859166] device eth0 left promiscuous mode
ceived by filter
0 packets dropped by kernel
 
[root@centos850 ~]# netstat -anlp |grep :80
tcp        0      0 0.0.0.0:80              0.0.0.0:*               LISTEN      895/nginx: master p
tcp6       0      0 :::80                   :::*                    LISTEN      895/nginx: master p

[root@centos850 ~]# netstat -anlp |grep :80
tcp        0      0 0.0.0.0:80              0.0.0.0:*               LISTEN      895/nginx: master p
tcp6       0      0 :::80                   :::*                    LISTEN      895/nginx: master p
[root@centos850 ~]# curl -o a.html http://10.0.2.2
  % Total    % Received % Xferd  Average Speed   Time    Time     Time  Current
                                 Dload  Upload   Total   Spent    Left  Speed
100  4833  100  4833    0     0   323k      0 --:--:-- --:--:-- --:--:--  363k
```

# in vm 's launcher pod 
```
[root@centos850 k6t-eth0]# ip r
default via 169.254.1.1 dev eth0
10.0.2.0/24 dev k6t-eth0 proto kernel scope link src 10.0.2.1
169.254.1.1 dev eth0 scope link


[root@centos850 k6t-eth0]# iptables -nvL -t nat
Chain PREROUTING (policy ACCEPT 282 packets, 22754 bytes)
 pkts bytes target     prot opt in     out     source               destination
   56  3384 KUBEVIRT_PREINBOUND  all  --  eth0   *       0.0.0.0/0            0.0.0.0/0

Chain INPUT (policy ACCEPT 3 packets, 252 bytes)
 pkts bytes target     prot opt in     out     source               destination

Chain OUTPUT (policy ACCEPT 1 packets, 423 bytes)
 pkts bytes target     prot opt in     out     source               destination
    0     0 DNAT       tcp  --  *      *       0.0.0.0/0            127.0.0.1            tcp dpt:80 to:10.0.2.2

Chain POSTROUTING (policy ACCEPT 2 packets, 751 bytes)
 pkts bytes target     prot opt in     out     source               destination
    0     0 MASQUERADE  all  --  *      *       10.0.2.2             0.0.0.0/0
    2   751 KUBEVIRT_POSTINBOUND  all  --  *      k6t-eth0  0.0.0.0/0            0.0.0.0/0

Chain KUBEVIRT_POSTINBOUND (1 references)
 pkts bytes target     prot opt in     out     source               destination
    0     0 SNAT       tcp  --  *      *       127.0.0.1            0.0.0.0/0            tcp dpt:80 to:10.0.2.1

Chain KUBEVIRT_PREINBOUND (1 references)
 pkts bytes target     prot opt in     out     source               destination
   55  3300 DNAT       tcp  --  *      *       0.0.0.0/0            0.0.0.0/0            tcp dpt:80 to:10.0.2.2
```
# in k8s node :
```
[root@CNSZ335291 ~]# kubectl debug virt-launcher-centos850-gl2dj

root @ /
 [4] 🐳  → tcpdump -i any  -enn
tcpdump: verbose output suppressed, use -v or -vv for full protocol decode
listening on any, link-type LINUX_SLL (Linux cooked v1), capture size 262144 bytes
03:38:05.670452  In ee:ee:ee:ee:ee:ee ethertype IPv4 (0x0800), length 76: 30.138.59.135.56054 > 172.16.250.13.80: Flags [S], seq 1213229664, win 29200, options [mss 1460,sackOK,TS val 89145759 ecr 0,nop,wscale 9], length 0
03:38:06.670963  In ee:ee:ee:ee:ee:ee ethertype IPv4 (0x0800), length 76: 30.138.59.135.56054 > 172.16.250.13.80: Flags [S], seq 1213229664, win 29200, options [mss 1460,sackOK,TS val 89146760 ecr 0,nop,wscale 9], length 0
03:38:08.674981  In ee:ee:ee:ee:ee:ee ethertype IPv4 (0x0800), length 76: 30.138.59.135.56054 > 172.16.250.13.80: Flags [S], seq 1213229664, win 29200, options [mss 1460,sackOK,TS val 89148764 ecr 0,nop,wscale 9], length 0
03:38:10.676146  In ee:ee:ee:ee:ee:ee ethertype ARP (0x0806), length 44: Request who-has 172.16.250.13 tell 30.138.59.137, length 28
03:38:10.676166 Out 3e:54:08:7a:60:26 ethertype ARP (0x0806), length 44: Reply 172.16.250.13 is-at 3e:54:08:7a:60:26, length 28
03:38:49.038281  In ee:ee:ee:ee:ee:ee ethertype IPv4 (0x0800), length 76: 30.138.59.135.56578 > 172.16.250.13.80: Flags [S], seq 760266929, win 29200, options [mss 1460,sackOK,TS val 89189127 ecr 0,nop,wscale 9], length 0
03:38:50.038487  In ee:ee:ee:ee:ee:ee ethertype IPv4 (0x0800), length 76: 30.138.59.135.56578 > 172.16.250.13.80: Flags [S], seq 760266929, win 29200, options [mss 1460,sackOK,TS val 89190128 ecr 0,nop,wscale 9], length 0
03:38:52.042465  In ee:ee:ee:ee:ee:ee ethertype IPv4 (0x0800), length 76: 30.138.59.135.56578 > 172.16.250.13.80: Flags [S], seq 760266929, win 29200, options [mss 1460,sackOK,TS val 89192132 ecr 0,nop,wscale 9], length 0
03:38:54.052133  In ee:ee:ee:ee:ee:ee ethertype ARP (0x0806), length 44: Request who-has 172.16.250.13 tell 30.138.59.137, length 28
03:38:54.052158 Out 3e:54:08:7a:60:26 ethertype ARP (0x0806), length 44: Reply 172.16.250.13 is-at 3e:54:08:7a:60:26, length 28
03:39:02.118791  In ee:ee:ee:ee:ee:ee ethertype IPv4 (0x0800), length 76: 30.138.59.135.56752 > 172.16.250.13.80: Flags [S], seq 4275132775, win 29200, options [mss 1460,sackOK,TS val 89202208 ecr 0,nop,wscale 9], length 0
03:39:03.120331  In ee:ee:ee:ee:ee:ee ethertype IPv4 (0x0800), length 76: 30.138.59.135.56752 > 172.16.250.13.80: Flags [S], seq 4275132775, win 29200, options [mss 1460,sackOK,TS val 89203210 ecr 0,nop,wscale 9], length 0
03:39:05.126313  In ee:ee:ee:ee:ee:ee ethertype IPv4 (0x0800), length 76: 30.138.59.135.56752 > 172.16.250.13.80: Flags [S], seq 4275132775, win 29200, options [mss 1460,sackOK,TS val 89205216 ecr 0,nop,wscale 9], length 0
^C
13 packets captured
13 packets received by filter
0 packets dropped by kernel

[root@centos850 net]# virsh list
 Id   Name                State
-----------------------------------
 1    default_centos850   running

[root@centos850 net]# virsh domiflist 1
 Interface   Type       Source   Model    MAC
-------------------------------------------------------------
 tap0        ethernet   -        virtio   02:00:00:a2:bb:18

```

**Environment**:
- KubeVirt version (use `virtctl version`): 0.34
- Kubernetes version (use `kubectl version`):1.19.2
- Cloud provider or hardware configuration: baremetal 
- OS (e.g. from /etc/os-release):  Centos 3.10.0-1127.el7.x86_64

# VM spec:
```
apiVersion: kubevirt.io/v1alpha3
kind: VirtualMachine
metadata:
  name: centos850
spec:
  running: true
  template:
    spec:
      domain:
        cpu:
          cores: 2
        devices:
          disks:
          - disk:
              bus: virtio
            name: disk0
          - cdrom:
              bus: sata
              readonly: true
            name: cloudinitdisk
          interfaces:
          - name: default
            masquerade: {}
            ports:
              - name: http
                port: 80
                protocol: TCP
              - name: ssh
                port: 22
                protocol: TCP
          rng: {}
        machine:
          type: q35
        resources:
          requests:
            memory: 2048M
      networks:
        - name: default
          pod: {}
      terminationGracePeriodSeconds: 0
      volumes:
      - name: disk0
        persistentVolumeClaim:
          claimName: centos850-qcow2
      - cloudInitNoCloud:
          userData: |
            #cloud-config
            hostname: centos850
            ssh_pwauth: True
            disable_root: False
          name: cloudinitdisk
```

**Comment by todaygood** [comment]
I found I didn't enable pod network forwarding in calico ,  After enabled,  the issue has been resolved.
